<?xml version="1.0" encoding="ISO-8859-1" ?>
<!DOCTYPE reports SYSTEM "../reports.dtd">
<reports>
	<report id="TopDonorReport">
		<description>
			This report considers gifts given between the two specified dates, and can include all gifts or, if
			selected, those to a particular motivation, motivation detail or recipient. For the defined set of gifts
			and its total value, the donors are sorted into a list, starting with those who gave most, and showing
			the percentage that their gifts contributed to the total received (for this motivation or recipient, if
			specified) and the cumulative percentage, moving down the list starting with the top donor.
		</description>
		<reportparameters>
			<reportparameter name="param_ledger_number_i"/>
			<reportparameter name="param_currency"/>
			<reportparameter name="param_start_date"/>
			<reportparameter name="param_end_date"/> 
			<reportparameter name="param_minimum_amount"/>
		</reportparameters>
		
		<reportheader/>
		<pageheader>
			<field whichfield="title1"><value text ="Top Donor Report" /></field>
			<field whichfield="title2"><value function="getLedgerName({{param_ledger_number_i}})"/></field>
			<field whichfield="descr1">
				<value text="Ledger "/>
				<value variable="param_ledger_number_i"/>
				<value text="   "/>
				<value function="getLedgerName({{param_ledger_number_i}})"/>
			</field>
			<field whichfield="descr2">
				<fielddetail condition="eq({param_donor_type}, top)">
					<value text="Top "/>
					<value variable="param_percentage"/>
					<value text="%"/>
				</fielddetail>
				<fielddetail condition="eq({param_donor_type}, middle)">
					<value text="From "/>
					<value variable="param_percentage"/>
					<value text="% To "/>
					<value variable="param_to_percentage"/>
					<value text="%"/>
				</fielddetail>
				<fielddetail condition="eq({param_donor_type}, bottom)">
					<value text="Bottom "/>
					<value variable="param_bottom_percentage"/>
					<value text="%"/>
				</fielddetail>
			</field>
			<field whichfield="descr3">
				<fielddetail condition="eq({param_recipientkey}, 0)">
					<value text="All recipients;   "/>
				</fielddetail>
				<fielddetail condition="not(eq({param_recipientkey}, 0))">
					<value text="Recipient: "/>
					<value function="getPartnerShortName({param_recipientkey})"/>
					<value text=";   "/>
				</fielddetail>
				<fielddetail condition="eq({param_all_partners}, true)">
					<value text="All Donors"/>
				</fielddetail>
				<fielddetail condition="eq({param_extract}, true)">
					<value text="Donors from extract: "/>
					<value variable="param_extract_name"/>
				</fielddetail>
			</field>
			
			<field whichfield="period1">
				<fielddetail>
					<value text="Period:  "/>
					<value variable="param_start_date" format="formatteddate"/>
					<value text=" To "/>
					<value variable="param_end_date" format="formatteddate"/>
				</fielddetail>
			</field>
			<field whichfield="period2">
				<value text="Motivation (Group,Detail): "/>
                <value variable="param_group_detail_desc"></value>
			</field>
			<field whichfield="period3">
				<value text="Currency: "/>
				<value function="getCurrency({{param_ledger_number_i}}, {GLOBAL:param_currency})"/>
			</field>
			
		</pageheader>

		<calculations>
			
			<calculation id="GetTotalAmount" returns="TotalAmount" returnsFormat="row">
				<query>
					<queryDetail>
						<value>
						SELECT 
						</value>
					</queryDetail>
					<queryDetail condition="eq({param_currency}, Base)">
						<value>
							SUM(detail.a_gift_amount_n) AS TotalAmount
						 </value>
					</queryDetail>
					<queryDetail condition="eq({param_currency}, International)">
						<value>
							SUM(detail.a_gift_amount_intl_n) AS TotalAmount
						 </value>
					</queryDetail>
					<queryDetail>
						<value>
						FROM
							 PUB_a_gift as gift, 
							 PUB_a_gift_detail as detail,
							 PUB_a_gift_batch
						 </value>
					</queryDetail>
					<queryDetail condition="eq({param_extract}, true)">
						<value>
							, PUB_m_extract,
							PUB_m_extract_master
						WHERE 
							gift.p_donor_key_n = PUB_m_extract.p_partner_key_n
							AND PUB_m_extract.m_extract_id_i = PUB_m_extract_master.m_extract_id_i
							AND PUB_m_extract_master.m_extract_name_c = {param_extract_name}
							AND
						</value>
					</queryDetail>
					<queryDetail condition="eq({param_all_partners}, true)">
						<value>
						WHERE
						</value>
					</queryDetail>
					<queryDetail>
						<value>
								detail.a_ledger_number_i = gift.a_ledger_number_i
							AND detail.a_batch_number_i = gift.a_batch_number_i
							AND detail.a_gift_transaction_number_i = gift.a_gift_transaction_number_i
							AND gift.a_date_entered_d BETWEEN {#param_start_date#} AND {#param_end_date#}
							AND gift.a_ledger_number_i ={{param_ledger_number_i}}
							AND PUB_a_gift_batch.a_ledger_number_i = {{param_ledger_number_i}}
							AND PUB_a_gift_batch.a_batch_number_i = gift.a_batch_number_i
							AND ( PUB_a_gift_batch.a_batch_status_c = 'Posted' OR
								  PUB_a_gift_batch.a_batch_status_c = 'posted')
						</value>
					</queryDetail>
					<queryDetail condition="not(eq({param_recipientkey}, 0))">
						<value>
							AND detail.p_recipient_key_n = {{param_recipientkey}}
						</value>
					</queryDetail>
					<queryDetail condition="eq({param_all_motivation_groups}, false)">
                        <value>
                            AND detail.a_motivation_group_code_c IN ({{param_motivation_group_quotes}})
                        </value>
                    </queryDetail>
                    <queryDetail condition="eq({param_all_motivation_details}, false)">
                        <value>
                            AND (detail.a_motivation_group_code_c,detail.a_motivation_detail_code_c) IN ({{param_motivation_group_detail_pairs}})
                        </value>
                    </queryDetail>
				</query>
			</calculation>
			
			<calculation id="MakeTopDonor" returns="automatic" returnsFormat="row">
				<query>
					<queryDetail>
						<value text="NO-SQL"/>
						<value function="MakeTopDonor({TotalAmount}, {param_percentage}, {param_to_percentage}, 
							{param_extract}, {param_extract_name}, {param_start_date}, {param_end_date},
							{param_recipientkey}, {param_motivation_group_quotes}, {param_motivation_group_detail_pairs})"/>
					</queryDetail>
				</query>
			</calculation>
			
			<calculation id="Donor Key" 
					returnsFormat="partnerkey" returns="text">
				<caption><value text="Donor Key"/></caption>
				<query>
					<queryDetail><value variable="DonorKey"/>
					</queryDetail>                                          
				</query>
			</calculation>
			<calculation id="Donor Name" 
					returnsFormat="text" returns="text">
				<caption><value text="Donor Name"/></caption>
				<query>
					<queryDetail><value variable="ShortName"/>
					</queryDetail>                                          
				</query>
			</calculation>
			<calculation id="Partner Class" 
					returnsFormat="text" returns="text">
				<caption><value text="Partner Class"/></caption>
				<query>
					<queryDetail><value variable="PartnerClass"/>
					</queryDetail>                                          
				</query>
			</calculation>
			<calculation id="Total Gifts" returnsFormat="currency" returns="amount">
				<caption><value text="Total Gifts"/></caption>
				<query>
					<queryDetail><value variable="Amount"/>
					</queryDetail>                                          
				</query>
			</calculation>
			<calculation id="%of Total" 
					returnsFormat="-#,##0.00;#,##0.00; ; ;" returns="text">
				<caption><value text="%of Total"/></caption>
				<query>
					<queryDetail><value variable="TotalPercent"/>
					</queryDetail>                                          
				</query>
			</calculation>
			<calculation id="Cumulative %" 
					returnsFormat="-#,##0.00;#,##0.00" returns="text">
				<caption><value text="Cumulative %"/></caption>
				<query>
					<queryDetail><value variable="CumulativePercent"/>
					</queryDetail>                                          
				</query>
			</calculation>
			<calculation id="Address" 
					returnsFormat="text" returns="text">
				<caption><value text="Address"/></caption>
				<query>
					<queryDetail><value variable="Address"/>
					</queryDetail>                                          
				</query>
			</calculation>
			
		</calculations>

		<levels>		
			<level name="main">
				<detail>
					<lowerLevelReport level="DonorLevel" calculation="GetTotalAmount"></lowerLevelReport>
				</detail>
			</level>
			
			<level name="DonorLevel">
				<detail>
					<field whichfield="columns" calculation="MakeTopDonor"/>
				</detail>
			</level>
		</levels>
		
	</report><!-- Donor Report -->
</reports>